document,topic_id
children prefer to play than to study.,-1
you should know how to cook chicken.,53
biwa lake is the largest in japan.,-1
they want to be nostalgic.,-1
ten years is a long time.,-1
i'm trying to remember.,52
he went to paris.,34
he went out for a walk.,37
you made all my dreams come true.,-1
bees are buzzing by the kitchen window.,30
"in the beginning, i will read it.",-1
i don't have time to cook.,19
he said that jokingly.,-1
what does this mean?,39
he takes a bath every morning.,-1
don't eat too much cake.,-1
do you like this color?,-1
when was the last time you jumped for joy?,-1
he made coffee for all of us.,24
he made coffee for all of us.,24
umbrellas are available for purchase.,-1
the arrogance!,7
the arrogant!,7
"maybe, maybe.",0
the shirt should be washed.,-1
the bar should be washed.,-1
the annex is to the north of the original building.,-1
"when i was young, there was a black pig fenced next to our house.",-1
we can continue if the traffic is not heavy.,-1
"can, can.",0
he said he has a platinum card.,-1
the boy invented his own logographic writing for his passion.,-1
it is said that logogram letters are only graphic art.,-1
tomas could not control his children.,68
i know you are.,-1
i prefer to be at home than to go out.,-1
it's not dinner time yet.,3
that's full.,-1
that's full.,-1
is the lojban language better if the dots are avoided?,-1
it's a table.,41
that's a table.,41
tomas feels like a new person.,1
kate baked an apple cake.,5
let me take a picture of you.,0
we went to the mountain to ski.,-1
i shudder to think about it.,31
think about yourself.,-1
children blow bubbles.,-1
there's more to life instead of rushing him.,-1
do not add sugar to coffee.,-1
i'm bursting with urine.,-1
i think he is mr. brown.,-1
i put milk in my coffee.,24
the students are back.,15
"your room number, please.",26
"with the return of winter, the days are getting shorter.",46
the whole mountain was red from the heat.,46
the whole mountain is red from the rainy season.,46
how long is the bridge?,78
we are noldor.,0
i am hiziel.,-1
are you one of the sindars?,2
is a noldo under the tree?,-1
i don't know how to speak kwenya.,-1
hisiel and nenwð guard the forest.,-1
many languages ​​use apostrophes.,-1
i am french,34
i saw him stealing pears from the orchard.,20
"when we were together, would you like to have tea at noon?",24
he can't be hungry; he just had lunch.,3
don't talk about it with anyone.,-1
the food is in the fridge.,3
the two-headed eagle of austria reigned over poland.,-1
maria bought flowers.,27
maria bought flowers.,27
did you come last night?,-1
turn right at the next intersection.,78
tomas made me a bird cage.,1
no smoking!,81
"tomorrow, i'm going home.",8
i like your car.,0
i can't eat anymore.,3
i discovered the truth.,-1
nothing is more useful than a photocopier.,-1
we aim for that objective.,0
that's magic.,0
be back before ten o'clock.,-1
tomas likes popcorn with a lot of butter.,53
this medicine will heal you.,-1
i intend to study english this afternoon.,49
fast and fun.,-1
he just started playing the piano.,25
i passed by his house yesterday.,-1
"if i were rich, i would buy it.",-1
do you have a phone,26
"in the past, meat was too expensive.",17
you or i will go.,-1
there is no sugar in it.,-1
don't eat!,-1
"yes, but that?",2
i listen to everything.,0
klabaster and gizmo are cats.,5
she is beautiful and really rich.,12
it's raining.,50
say it in english.,0
it's an old piano.,25
the rose belongs to teodoro.,27
the boy was quiet.,-1
one hundred percent pure apple juice.,20
real men drink tea.,24
this is your book.,6
who teaches you?,2
don't tell anyone.,-1
i lay on the grass.,-1
someone is knocking on your door.,30
what good is reading such books?,6
buy me a box of chocolates and i'll be satisfied.,74
he saw you at the theater.,-1
the child counts to twenty.,28
"if you have a cold, take this medicine.",-1
i want him to do the hard work.,12
he didn't listen to me with his mouth.,-1
"tomorrow, why don't you come and play?",-1
"in february, there is a lot of snow.",46
i didn't measure what they said.,-1
it's all in your imagination.,82
tomas said it's all in your imagination.,-1
you turned pale with fear.,-1
i will peel an orange for you.,0
they said he was still alive.,12
all is well at home.,8
what are you doing here,2
he doesn't think the writer is good.,9
my baby can't speak yet; he was just crying.,-1
what is the objective of education?,15
i want to work with you.,0
he doesn't like his mess.,4
"hand over the street map, will you?",-1
what are you crying about?,31
go on without me.,-1
tatoeba is a dictionary.,-1
did you see that?,2
i am.,0
your legs are really sexy.,21
my opinion is definitely different than yours.,42
we're coming back to europe in june!,7
knowledge of the language is one thing; teaching it is something else.,-1
imagine you are in my skin!,-1
i think esperanto is not blondo.,-1
i think his story is true.,-1
gðtom is the best salsa.,-1
i prefer strong coffee to fat coffee.,24
"please give me the key, will you?",-1
he tried to be rich and famous.,-1
did i hurt you,-1
i have difficulty concentrating.,31
they told maria everything.,-1
worked when they worked in the factory.,36
"will i die ""no, you're going to rest.""",64
you need to find a cheaper alternative ingredient even if you are reading your grandmother's prescription.,-1
he forgot his book in the square.,6
my clothes have a greasy smell because i ate at an okonomiyaki place.,-1
he makes delicious pizza.,3
"if he doesn't go, you should take his place.",9
you mean you lack sweethearts?,-1
tomas saw maria on television.,11
are you ok,2
who teaches you french?,34
the waves are high.,33
i ate lunch in a hurry.,3
"bread is made of flour, water, and often yeast.",3
he is wearing white shoes.,-1
he said he was sick.,4
we are slowly growing.,0
the air in big cities is polluted.,-1
i do not doubt that you will read my letters.,-1
do you want to cook japanese food?,-1
i now prefer going out instead of staying at home.,-1
who do you want to talk to?,2
different people have different customs.,-1
he is addicted to alcohol.,51
he gave me an example.,13
"hold my hand you and i, together we will create utopia.",0
i'm surprised!,7
come with us if you want.,0
there is a letter in this room.,32
you can get the book if you can read it.,6
there is a visitor named ono who wants to see you.,-1
it's a kind of orange.,-1
matias is from uruguay. he is uruguayan.,77
he is a boy in his twenties.,28
he was a boy about twenty years old.,28
can i start eating now?,3
he whispered something to her.,12
you must take good care of our planet: tierra.,16
you boy is licking me.,-1
languages ​​are my passion.,-1
drinking alcohol is not good for health.,47
did you follow your plan?,2
when do we eat i'm hungry!,3
we might see bird nests.,-1
i can see the tower in my house.,35
"beware of kidnappers, ken.",0
i want to study in paris.,34
he lived alone in a hut.,-1
he and only he knows the whole truth.,-1
"because the universe is really vast, you are really small.",-1
"soul, he told me.",13
"gladly, he told me.",13
there are different forms of government.,7
they are getting skinny waiting for the war.,-1
our cow does not give us milk.,-1
"it's nine o'clock, he said.",-1
why are you shouting,2
grape dye is my favorite.,20
he worries about his friend.,4
he worshiped his friend.,13
why are you trying to run?,39
have you ever eaten raw fish?,-1
the ship will stop at yokohama.,-1
has playt 123 arrived yet?,2
my aunt grows tomatoes in her garden.,-1
lack of fuel.,17
someone speaks portuguese.,48
have you been to france?,2
"more coffee? ""no, it's okay.""",24
i want to learn to play the banjo.,25
how does the internet influence human memory?,36
all the milk was spilled.,24
that's not blood. that's betabel.,-1
i fell asleep in class.,15
goro is good at english.,49
tomas was lucky.,1
how was your french class?,15
something is better than nothing.,-1
"no... yes, by the way.",-1
someone opened the door.,30
what's on the desk?,32
do you think he's gay?,-1
he's really bad because he's wearing no fashion.,9
do you think he is not gay?,-1
physical education class is mandatory for everyone.,15
he is what we call a diamond boy.,55
you can't ride a horse.,-1
tell me when to stop.,-1
i remember 1976.,-1
i remember 1976.,-1
i remember 1976.,-1
i tasted his book.,6
it was there.,-1
he wonders at her stupidity.,4
"because she's afraid of technology, she's like a real girl.",-1
i want to travel alone.,73
what is your favorite harry potter book?,6
a turkey is slightly larger than a chicken.,53
no one can know everything.,-1
the port is closed to sailing.,-1
religion is not important to him and he does not believe.,60
religion is just entertainment for the masses.,60
religion is art.,60
the picnic was cut short due to rain.,-1
jupiter is said to be haunted by various forms and shadows.,16
never lived and always dead.,64
"some argue that the plural suffix -j in esperanto is influenced by greek, or ancient greek.",-1
"he wanted to memorize the entire lojban dictionary, but he knew a few words would be enough.",-1
is it edible?,3
he was born and raised in tokyo.,14
we gave the car a push.,5
your zipper is open!,30
why didn't you say earlier?,-1
"people are not good, ebyang said. he is right.",9
there are more bags in the world.,17
the reality looks different from the future we have waited for.,-1
"even if there are predictions in scientific history, we are not flying on a rocket on a wing, nor are we vacationing on the moon, nor are we eating like a pill, and we are not enjoying the luxury of doing nothing while robots are creating a wealth society.",-1
"in the 50s and 60s of the 20th century, the mind about the future of the world was more optimistic than today.",28
he wanted to die and swim out of the river.,-1
i don't call you stupid even if you seem to be more stupid.,-1
i think you are more stupid this morning.,42
study what you want and don't be jealous.,-1
we went for lunch.,-1
you got married and you are not happy anymore.,-1
have you ever seen blue popcorn?,53
the air warmed up.,50
he must be angry.,4
nara is a calm and beautiful village.,-1
i often have terrible nightmares.,31
i think the ancient war has gone on long enough. more fully said: too long.,-1
who is your teacher,-1
juan is at the airport.,-1
stormed the city and damaged it thoroughly.,-1
"crows like tokyo because it's warmer in the city than in the suburbs, and it's lit up at night.",14
this mountainous landscape is really beautiful.,46
"only a few studied that art, and he was one of them.",-1
"borrow your book, please.",6
what's your favorite seasoning?,-1
he should study epistemology and ontology.,-1
"until there is reason or evidence, we don't know if what he says is true.",9
is that true? where did your information come from?,-1
did he really reveal all 2136 kanji logograms?,65
there are cherry blossoms on every side of that street.,27
my house is next to the station.,18
what kind of book do you wish you had?,6
are you afraid to die?,56
where can i buy books?,6
"now, he says that's not love.",-1
"now, he says that's not love.",-1
how long have you been studying english?,49
your skirt is already loose.,-1
i see a rare flower in the vase.,27
your mind is closed if you don't use your imagination.,-1
"reality is not enough for most; so, they need imagination.",-1
there is a storm in a glass of water.,-1
will you give kate the flower?,27
he is an arrogant boy who thinks to himself that he is better than everyone else.,-1
i studied tennis with my brother.,75
he is fluent in english.,49
"do you prefer the apple, or the pear?",20
westerners wait for christmas.,7
"in japan, christmas is like the festival of san balentino.",7
"in japan, december 25th is like february 14th.",14
"at times, tatoeba is like eliza, the psychiatric computer.",-1
"if you want to talk, talk!",-1
your religion is your language.,60
can i borrow your pink pen?,27
they don't understand what you write.,10
windy.,-1
do you want to have dinner together at the weekend?,-1
call me if you want.,26
"you are desperate; if you really like interlingua, study it.",-1
ugly spelling is no better.,-1
ugly spelling can't do math.,-1
you're confused!,7
you are dumb!,7
you fool!,7
you are stupid!,7
you sweat!,7
you are sad because it is christmas.,31
my grandfather takes medicine every day.,8
is ekmek food greek or turkish?,3
i will learn to love this bitter life.,-1
i had to clear my doubts about that.,31
someone in a truck almost died from the cold on the street.,-1
you guys have been lazy!,7
what are you doing there? just hanging around?,2
you don't want to use your head.,57
your head feels like lukewarm soup.,3
you have practiced as if you are always bored in life.,-1
you always smoke weed.,-1
there are many addicts in the world today.,-1
you are really sad.,31
your cultures seem insignificant.,-1
"you are always being ordered, so you think like that.",-1
that's a maid's mind.,53
they sleep all night long.,-1
they are afraid of shadows and shadows at night.,-1
they believe in night visions.,82
do they believe in harvesters?,-1
it is said that it is better to eat the rectum of the coconut.,20
he is lingming.,-1
the mind is confused.,31
he said that the clay was really good for him.,12
"at night, the trees sway and there are bats in the sky.",22
his skin was rough because of the people he worked with outside.,4
my name is ludwig.,-1
the man was afraid.,56
are you listening to me,2
i have no more than ten books.,6
i'm out all day.,8
my little cat has been missing for a week.,5
never touch this bottle again!,-1
i go to school.,-1
i brought his umbrella by mistake.,-1
she makes her own clothes.,-1
he was the last person to lie.,-1
i should go out.,-1
i will show you the place where people can still breathe.,-1
do you have something to hide?,-1
it's time for you to sleep.,23
you have a headache.,31
whatever happened has happened.,-1
your language is tiring.,-1
you always take things too seriously.,-1
do you have something to report?,2
you need vitamins to keep your mind healthy.,-1
"today, the sky is overcast.",22
the problem with your mind may be a matter of physics.,-1
you're really out of your mind.,-1
i'm not afraid of you.,-1
better see a specialist.,54
you get dizzy reading your language.,-1
"in fact, they lived here all winter.",46
you are talking about people and human relationships.,44
you think your life is short because you look like an american.,-1
"in the sky, there are so many stars that i can't count them all.",22
do you remember this game?,-1
the war is only in your mind.,82
don't draw your life in anticipation of war.,47
he has a bush full of strawberries.,20
the true nature of the planet alpha centauri bb is still mysterious.,16
the planet alpha centauri bb is 4.37 light-years from our earth.,16
"if we use our technology today, it will take 40 000 years to reach the planet alpha centauri bb.",16
"we live in a society, not just an economy.",-1
have you ever played baseball?,75
makes a mess nearby.,-1
the location of ken's notorious dog is unknown to him.,9
it is necessary to use the dictionary.,-1
tom is a vampire.,1
the cat seems to need the water.,5
long time no see!,-1
why do you always see tom?,1
the tea is hot.,24
the tea was so hot that i couldn't drink it.,24
that's why i'm here.,-1
he was disfigured.,4
i will tell you a story.,-1
he told me where to shop.,-1
it rained all day yesterday.,50
come now!,7
he smiled broadly at us.,13
he drank straight from the bottle.,51
i study hard.,-1
is that okay?,2
don't speak too fast.,-1
language is the paint of our ideas.,-1
you want to learn that language for fantasy.,-1
tomas wants coffee.,24
you are confusing jane and her sister.,6
i went to the same school as kenji.,14
there is a secret path in my mind to my youth.,-1
every new language is like a game.,-1
"alpha centauri has three stars. they are a, b, and c.",16
"the word ""planet"" comes from the ancient greek for ""wanderer.""",16
i know you're smart.,0
you need a haircut.,-1
you know that's wrong.,42
do you see the book?,6
you have to work hard.,59
i can't eat raw eggs; must be cooked.,3
the baby is not crying anymore.,-1
"he's a smart kid, really.",55
we swam in the sea.,0
"what, this is the nata de coco that everyone is talking about.",-1
there is a strike.,0
what time does this train arrive in yokohama?,18
tomas chose to live in boston.,1
he often practices playing the piano.,25
i went to the supermarket.,17
chopped down the trees? not all? next to the road.,29
used by many people.,-1
it's aquarius season.,22
will you come with me to the river?,2
i'm a little lost in the jungle.,-1
"we have four rabbits, and one of them bites.",29
"the iron, pot, and heater should not be lit at the same time.",-1
we spent the night at the mountain hut.,-1
he went to the store.,-1
these vegetables take a long time to cook.,20
"it's noon, so turn off the television.",72
what he said is not important.,-1
"please tell me again, yes.",0
whether he succeeds or not depends on his health.,-1
next to the table is only one chair.,41
i will accompany you.,0
he shaved his armpits.,4
breathing alone is not sustenance.,47
she had long hair last year.,21
does your brother live there?,76
the sun is shining brightly.,22
the bees buzz around them.,30
this is not possible.,10
really many people know him.,-1
he was knee deep in snow.,46
the force of the wind!,7
get a cake if you want.,74
easy parking in the park.,-1
he traveled to europe.,71
there is nothing there.,-1
he plays the guitar well.,25
it's rare.,0
what is the name of this flower?,27
you are afraid of science because you look like a girl.,56
who is really poorer among us?,-1
what happened and you're thinking about money?,-1
smile.,0
i'm usually in bed by nine o'clock.,23
good afternoon,-1
"it's fine, thank you.",67
what is your name,2
my name is jack.,40
where are you from,2
nice to meet you.,0
nothing.,19
english is fun.,49
"good, and you?",2
how are you,2
shall we have popcorn?,3
opinion is that thing that i will reason why all the world should think my thinking.,-1
we will meet again tomorrow.,-1
don't talk about such things.,-1
this is a photo of the airport.,-1
"you're talking nonsense, my friend.",42
"they look like women too, don't they?",21
you know i'm an expert and you're crazy.,0
i do radio after dinner.,-1
he is a kind person.,13
"cheers to speech, indeed.",0
the story passed from person to person came to life.,-1
all they want is women's talk.,-1
"they really do look like girls, don't they?",21
you seem to be from the countryside.,-1
some are tired.,-1
it has become a foreign newspaper.,-1
nope.,-1
i'm looking for my own truth.,-1
stracciatella ice cream is nothing but ordinary ice cream with chocolate chunks.,-1
have a good day mr. brown.,-1
"get some sleep, okay?",23
i didn't see him.,-1
you are always afraid because you look like a girl.,56
the students are mostly women.,15
what is it like you don't have a family anymore?,-1
you are arrogant because you seem to be trampled on every day.,-1
you thought i was a human being.,-1
speak english because you really know how.,49
"you speak english really well. go ahead, speak english!",49
you cried because you didn't congratulate.,10
congratulate yourself so you don't cry like that anymore.,-1
can i have a paper bag?,32
even your religion is female!,60
what color cake do you want?,-1
tomas poured himself a drink.,51
is this a new car?,5
i can change.,0
i don't want you to change.,58
i can change.,0
i don't want to change you.,58
could you turn off the light?,-1
in the plain rises the mountain.,46
"which is your book, this or that?",6
kay respects everyone but herself.,-1
some boats are sailing on the lake.,33
which is taro's?,-1
"in the past, the theater was open on saturdays as well.",-1
how long are you in kyoto?,14
you are thirsty.,51
he came to pick me up.,37
we will take you to the island's airport.,-1
i am not your enemy.,58
your head is broken because everything is just work.,-1
you get used to crying every day because you don't have sex.,-1
your mind and heart are dark.,-1
you are afraid of the cat because it is quiet and seems to be smarter.,56
he does not believe that someone has reached the moon.,9
they lied that they had reached the moon.,-1
he gave his life for his country.,12
cats peed on them.,5
he cut the cord by two meters.,18
do you have money with you?,-1
you really have no sexual activity because you are still crying.,-1
you are the most feminine of us.,-1
"is ""arrogant"" better?",7
your thoughts are really western.,-1
here's my secret.,0
it is very simple: only through the heart can one see well.,-1
the heart of things cannot be seen with the eyes.,79
tony undressed and cleaned his shirt on the piano.,25
"unwrap, please.",-1
he lives alone in the forest.,-1
can i play after reading this book?,6
i don't understand you.,-1
my parents don't speak english.,43
there is a restaurant here that i often eat at.,-1
is there a dish in your meal?,3
he is a reliable person.,-1
isn't it clear?,39
let's fly kites.,33
who lives in that house?,35
"you're friends with tomas, aren't you?",1
"how do you say ""apple"" in your language?",-1
reading a book is fun.,6
the meat is grilled.,-1
"do you prefer meat, or fish?",-1
i bought a picasso.,-1
andorra is a small principality between spain and france.,77
would you like a cup of milk?,24
i didn't mean to.,-1
we always have a party for his birthday.,66
you always cried.,31
why?,39
"you need the brain doctor, right?",54
your problem is not only about sex.,-1
you thought you were too old.,-1
you are boring because you lack fantasies.,-1
why do you want to discuss religion?,60
don't believe in religions anymore.,60
i want you to say what you think.,-1
let's drive to the sea.,33
"religion is an art, not a science.",60
you women know what they are doing.,-1
your language is sick.,-1
come back here running.,0
eat whatever you want.,3
there are many tricks in the library.,6
where did that happen?,-1
he promised to look after it for himself.,-1
this is my secret.,0
really simple: no one sees good except in the heart.,-1
the most important thing is invisible to the eye.,79
peace of mind is obtained by not relying.,9
i don't have a car.,19
i don't have a car.,19
your thoughts are really western. it's like a prison.,-1
your country is becoming a woman.,21
my interlocutor here is purely female.,21
it was 1994 that i knew people on the internet were crazy.,36
my father will be happier if i become a professor.,38
there is nothing like eating chocolate in the morning; gives me a good feeling all day.,74
he studied economics at university.,-1
i drink the soup straight from the bowl. japan is like that.,3
this fresh raw fish is delicious.,53
happiness cannot be bought.,-1
the tin box is empty.,-1
he bravely lived on his own in the desert.,-1
let's hope he works.,13
you thought you were a nigger.,-1
you have the mind of a slave. you look like a nigger.,-1
it's like you're dead because you don't want to work anymore.,64
"you are afraid of your god, so you are nervous.",56
you really have become a nigger.,-1
maria became pregnant at the age of 14 years.,28
quebec's french speakers are over seven million.,34
i caught five fish yesterday.,-1
"better yet, ask dr. tanaka.",-1
how many players are needed for rugby mats?,-1
i like castles.,-1
don't talk about my family anymore.,-1
you love east asiatic letter logograms.,-1
his mind seemed to be spinning as he studied asiatic writing.,-1
"it's like you don't have a family, so you're talking about my family.",43
i'm not sure if the cake really thickens.,74
"because the stars are just like sand, the woman is afraid of astronomy.",22
"tiyera was just like a speck of sand, so the woman cried.",-1
the woman does not know that the universe is really vast and she is really small there.,-1
science is not fantasy.,-1
what is that it's like you're being strangled.,-1
because i too get hit by this line.,0
i have forgotten what i learned.,52
he should not walk on this rock.,-1
he's really funny.,13
"yes, this thread is interesting when it's wet.",-1
"for i, since marriage, have never met a man like you.",-1
you are afraid because of your idols.,56
you seem very old.,-1
you should have kept that a secret.,0
"i am too old and sad to play, said the boy.",-1
you thought you were a girl because you were a bag.,17
"if the person is old, he can still be circumcised.",-1
it is also important for a woman if her man is circumcised.,-1
i can't be sure if he will be here tomorrow.,-1
he photographed the koala.,12
a hamster running on a non-stop spinning wheel.,1
what is the most common language in peru?,-1
son of a bitch!,7
it's not the fault of the truth that the crooks say it.,-1
let's start.,0
everyone got up and started dancing.,-1
they are afraid that the yellow leaves will fall on their street.,29
the german was scared because his beer was yellow.,-1
he was afraid because his tribe was different.,-1
"his tribe looked different, so he was scared.",-1
are you hungry you are talking about dining.,3
go out and eat at a restaurant.,-1
they don't have a car.,19
cloudy.,22
come here to enjoy the sunshine.,22
maria is interested in politics.,11
the curtains fluttered in the wind.,30
the wind raised the sail.,50
"not only does that sound like an insult, but a woman's ""projection"" from her own mind.",-1
"sometimes, the woman uses objects placed according to the ""projection"" of her mind for communication.",-1
"you should be sensitive that what different people say is just a ""projection"" of whatever is happening in their own lives.",-1
some believe that there is a part of the brain that is responsible for insults and that it is more active in other people.,-1
it is a disease and sometimes endemic to the entire race.,-1
araw is really far from tiyera.,-1
does he go to school?,-1
"sorry, but i can't stay long.",-1
racism is your hard work.,-1
