document,topic_id
"people sleep when they live, they wake up when they die.",64
"bring me vinegar and oil, please.",-1
the incas were a religious people.,60
you have frizz in your hair.,-1
this is the hottest summer we've had in fifty years.,22
this book is not as interesting as that book.,6
tom is wearing a new pair of shoes.,-1
this is my car.,5
"a friend from oregon, mr. brown, will visit us tomorrow.",-1
wake me up,-1
"he gave us not only clothes, but also some money.",-1
"yes, i went there 2 or 3 times.",-1
where is the nearest museum?,-1
the war is still not over.,-1
"when he got home, he played a computer game.",36
he went to america.,-1
i heard that he passed the exam.,15
tuesday is independence day.,8
i received bad news from home today.,-1
"he is wearing the shoes, but he is not wearing the socks.",-1
don't stick paper on the wall.,32
she will have a baby next month.,-1
i have finished doing all my homework and i want to rest for a while.,-1
she always took a long time choosing her clothes.,-1
fred wrote a long letter to his mother.,21
"as for you, i will be silent.",-1
we are going to the grave now.,0
he was recognized by many inside the theater.,-1
they brought me some books.,6
i was even more angry because he laughed at me.,4
who is this person?,2
i want to know why he said that.,12
we bathed in mud.,0
tom is bald.,1
describe tom to me.,1
make him wait a moment.,37
physicians save lives.,54
the sad story made us cry.,-1
"i like him not because he is nice, but because he is honest.",-1
that will happen.,0
he wrote a letter.,-1
nothing solves this problem.,-1
tom doesn't always get what he wants.,1
thank you for trusting me.,-1
they are one of us.,0
he could not study abroad due to lack of money.,9
you don't know how worried i am.,9
it is the students' job to clean their classrooms.,15
i looked around.,-1
my sister is playing with a doll.,-1
"yes, i have a great idea.",0
he went blind.,4
they found the body of a newborn baby inside a freezer.,-1
what can i say?,-1
i can't tell you what to do.,9
i want tom to tell me what he means by that.,1
no one came today.,-1
he has strong bones and teeth.,13
i dream of going to mexico.,48
"he has three sisters: one is a nurse, and the others are teachers.",55
a ship sank yesterday near here.,33
i forgot to bring my umbrella.,52
"in paris, they speak french.",34
she is his wife now.,12
i hope you die.,-1
he came carrying a large bunch of flowers.,27
"at first, i didn't know what to do.",10
tom's early arrival; mary is not ready yet.,11
i know the whole story.,-1
tom does not have diabetes.,1
tom isn't done yet.,1
tom is not helping.,1
tom was not surprised.,1
tom is not there.,1
it is possible that he is telling a lie.,-1
why aren't you in boston?,2
dinner is almost ready.,3
all kinds of people live in tokyo.,14
i never saw him again.,-1
tom has been lucky all his life.,1
he inherited the house.,35
i better take you home.,8
"if he says ""i love you"" all the time, it's not true.",9
i hope you listened to me.,0
i thought you wouldn't like me.,-1
i said goodbye to the guests.,-1
give me a cup of coffee.,24
the mouse is here!,7
call the cat!,5
i lived in sendai for ten years before coming to tokyo.,14
jack can't afford a new bike.,40
nope. i am english,63
i don't see the little car.,5
i am serious about my work.,59
"if you want to know how to use a word, look it up in this dictionary.",-1
tom got here before me.,1
you can eat the rest of the pay.,17
these animals are tame.,29
i just had lunch.,3
the dog followed me.,45
girls first.,21
what is that big building in front of us?,-1
please wash your hands.,-1
i won't let you leave.,-1
he traveled all over the world.,12
do you think i should go alone?,73
"i learned french, before going to europe.",34
it's not cheap to eat here.,-1
how was he yesterday,-1
i will accompany you to the airport.,-1
the road to the village is very bumpy.,-1
a piano is expensive.,25
"visit us, please.",0
they eat chocolate.,74
you are getting dressed.,-1
a king's daughter is a princess.,-1
green is beautiful on alice.,-1
the famous building taj mahal is in the country of india.,-1
we found him alive.,13
the violence lasted for two weeks.,-1
i said that.,0
put some water on the burn.,-1
the medicine is thick.,54
where do you want to go?,2
they checked the machine for defects.,9
his index finger is shorter than his ring finger.,-1
did you tell your parents?,43
he who desires too much gets nothing.,-1
defending one's country is a sin now?,-1
do i smell bad,-1
have you had lunch,3
have you met him?,61
is there a book on the table?,6
we have two daughters and two sons.,-1
someone stole my umbrella at the bakery.,-1
tom always watches tv.,72
i will miss you too.,52
"this is my blog, which will introduce me and reveal about my daily life.",-1
"i want tokwang mapo, and two bowls of rice.",3
how many bowls of rice did you eat?,3
you cannot use this faucet. it's broken.,-1
the shape of the cake is full.,74
i thought he was my brother.,76
how many barbers work in this barber shop?,-1
what song is he playing?,61
your success is the result of your hard work.,-1
i want you to speak french.,34
tom tells mary not to go there alone.,11
tom will be here tomorrow.,1
"after almost a month, i still remember the word.",52
get in the car.,5
i have to go home.,8
the money is brid's.,17
the house has three floors.,35
i don't care about the cost.,-1
her chest is big.,21
i speak french with my teachers.,34
can't you speak softly?,-1
i need a nurse now.,-1
he always walks to school.,-1
tom has only one leg.,1
smoking is a bad habit.,81
what is the most delicious fruit in japan?,20
you ruined everything.,42
what does he say in the letter?,61
i didn't sell anything today.,19
tom is a priest.,1
tom doesn't seem too tired.,1
you know where to find me when you need something.,65
don't cry.,57
he was blushing.,4
they are out of sugar.,-1
i want to know who will be with us.,-1
the monkey climbs a tall tree.,29
i have neither money nor friends.,19
i put some milk in my coffee.,24
they will kill you!,-1
how much did you pay for that?,-1
tom wants someone to love him.,1
"it's not cheap, is it?",-1
and why would i do that?,39
he was the only one who came to the party.,-1
"when you're a good kid, you get candy.",-1
tom built his own house.,1
the wet clothes stuck to my body.,-1
the room smelled of tobacco.,-1
"if that guitar wasn't so expensive, i'd buy it.",25
the sun lights up the world.,22
tom doesn't know why mary doesn't like him.,11
what is he after?,61
if this dog can look at me it's like he wants to eat me.,9
if only we had a garden!,-1
do you like the green or the blue?,-1
"whatever, it's the same.",0
can you speak mandarin?,14
ann has no sisters.,19
brush your teeth after eating.,-1
we all speak french.,34
tell him i'm fishing.,-1
i drive a car.,5
here are your keys.,-1
tom doesn't like dogs.,1
many guitars have six strings.,25
we are arabs.,-1
they worked like bees.,30
we will when we have time.,-1
unfortunately it rained.,50
the man was obviously wrong.,42
what he is doing is forbidden.,-1
how did tom know that?,1
i will look for a job in china.,14
he asked the professor several times.,12
i didn't listen to the news yesterday.,-1
is that your car,5
tom ate a crocodile.,1
the towel is so useless.,-1
give them to him.,-1
it is said that anne is getting married this june.,-1
your answer is correct.,0
do you want me to call the police?,62
"wherever he goes, he lies.",-1
do you understand what i'm telling you?,39
people love to talk.,-1
i wish you said the meeting would start at 2:30.,8
"when i woke up, i was in the car.",5
they don't understand me when i speak in french.,63
the girl broke the glass of the window.,30
i ask myself when the plane will arrive on time.,8
all you have to do is sweep the floor.,8
who is tom's sweetheart?,1
it's much cheaper if you take a bus to get there.,-1
don't know how much sugar that cookie has?,3
"in this store, we sell anything.",0
our professor paid for us all.,12
quiet!,7
do you see the star?,2
is honey thicker than skin lotion?,-1
i saw my aunt in europe.,71
barrichello drives very fast.,-1
"there are not enough benches inside the ""conference room"".",-1
are you going there,2
you can choose any of them.,0
when does the show start?,2
he will be back tomorrow or the day after.,-1
how do i become a robot? robots don't dream.,-1
love others as you love yourself!,-1
you need to go there immediately.,-1
it's not my fault.,58
will he swim tomorrow?,-1
yes.,0
do you have a spare room for tonight?,-1
we ate fried meat.,3
he will be back after an hour.,-1
the dove is a symbol of peace.,-1
tears are a child's weapon.,79
do you know him personally?,-1
do you really need a car?,5
i know tom is shy.,1
i'm not hungry.,3
do not bring any food into the laboratory.,-1
do not eat inside the laboratory.,-1
time erases many memories.,-1
that is as hard as a rock.,-1
he was angry with us.,4
"tom is here, but bill hasn't arrived yet.",1
why are you sad,31
that's a map.,-1
two bombs fell on the city.,-1
my father is in the hospital now.,38
how much is this radio?,18
they invited me to play cards.,-1
i love him,-1
"what do you mean, ""i don't want""?",-1
i have many friends.,44
my father and sister are carpenters.,38
never play on the road.,-1
i'm not tom's mother.,1
there will never be communism in my lifetime.,-1
in this place the battle took place.,-1
this is the place where the battle took place.,-1
the cat is black.,5
he is nervous about the result of his exam.,15
darkness is the absence of light.,-1
he has a dog.,45
tell me the truth,-1
that's the pen i lost yesterday.,32
do you want to rest?,2
i will come soon!,7
i took that exam in the meeting room.,15
the clouds are low.,22
land prices in japan are sky high.,17
flies will not disappear where there is honey.,57
it was planned to appear as an accident.,40
i am doing something.,0
it is not easy to learn physics.,-1
the majority of the police have lost their jobs.,62
we went to the lake to bathe.,33
you are free to say what's on your mind.,-1
cervesa bottles are made of foam.,-1
this is the road i walk every day.,8
two dogs fought over the bone.,45
do whatever he tells you to do.,-1
strong winds accompanied the rain.,50
the police found the person who killed him.,62
ken asked me to the bank.,-1
tom only drinks coffee.,1
he came out for america.,-1
do you think?,2
i need a massage.,-1
i want to love you forever!,-1
the bleeding does not stop.,-1
"which is bigger, the sun or the earth?",-1
are you sure you don't have enough money to buy that?,-1
beautiful scenery.,22
the sun was covered by a blanket of clouds.,22
he sleeps on an expensive mat.,23
i really believe in your ability.,0
you opened the wrong box.,-1
i was just here yesterday.,8
he left the room when i entered.,37
why don't you come in?,-1
i'm used to that now.,0
look at that mountain.,46
"i'll be back, said tom.",1
be creative.,0
i smell with my nose.,-1
the leaves started to turn red and yellow.,29
i am poor.,-1
who do you love?,2
you have to teach me what you know.,0
my father caught three fish yesterday.,-1
who wants to start?,2
would you like something to drink?,51
"no, thank you. i will drive.",-1
what ship do you see?,33
i thought my eyes tricked me.,79
this church is a very famous and very beautiful place.,-1
peter is my best friend.,1
i need to lie down.,-1
the dictionary is on the table.,-1
i am happy that the apple i am eating is green.,20
"i need to buy food, but i don't have enough money.",3
do i have to use the ink to write?,32
i ironed my clothes.,-1
why is the moon so big tonight?,16
tom is a little older than the other students in the class.,15
we go to the cinema on saturday and then to the restaurant.,-1
did you cough?,-1
"where i live, it snows in january.",46
climb,0
we haven't seen each other since 2009.,-1
was that long ago?,2
i have a big dog.,45
"he tried, and he did.",12
i think you are putting too much sugar.,-1
that's mine.,0
i don't know where yours is.,10
nothing happened.,19
he cannot be a poet.,9
he was thirsty.,51
the room will be painted tomorrow.,8
tom almost smiled.,1
he is the son of a rich man.,-1
he is the son of a rich family.,55
twice he was mistaken for a spaniard.,-1
"those clothes are similar, except for the color of the buttons.",-1
i saw him naked.,-1
tom is a reporter.,1
what will i say when he comes?,-1
do you have a big house?,35
the sun came out.,22
the room has two windows.,-1
i love my language!,80
this chair needs to be fixed.,41
do you eat meat or only pureed vegetables?,-1
i'll give you another chance.,-1
i don't know what to say.,10
"excuse me, can you please not put wasabi on the sushi?",-1
i'll take that.,0
that baby is tom.,1
but he didn't know that yet.,-1
he is coming closer.,13
everyone wants to be happy.,-1
"he ate beef, the woman answered.",3
i can't travel by plane.,-1
your children are in the garden.,68
sometimes he goes to work by car.,-1
peter and paul said they would also die like a martyr.,64
"like it or not, you have to do that.",-1
you are good and know how to speak tagalog.,-1
he got sick a few days ago.,4
he has a funny face.,13
his hands were empty.,-1
"who helped you? ""it's tom.""",1
we climbed up to the top.,0
you didn't lend it to him.,10
don't push.,57
he needs money.,-1
isn't he the one sitting on the bench?,65
he is working now.,-1
you live with your parents.,43
do you know each other,2
i'm fine.,-1
i prefer apples to oranges.,20
avocado is rich in vitamin e.,20
i have never smoked.,-1
what grade is your sister in?,-1
i don't believe it will rain tomorrow.,-1
we heard a gunshot.,-1
i need to eat.,3
he has only one goal in life: to have money.,-1
mary ran.,11
tom didn't go to work last monday.,1
does anyone here speak japanese?,14
i can't ask the professor about that.,-1
those students are inside the classroom.,15
please accept my grief!,7
"if i were a bird, i would fly towards you.",-1
i didn't do it because i didn't want to.,10
i want to know too.,0
you work too much.,59
the book is small.,6
give me the cup of coffee!,24
i hope i don't lose.,-1
i'm taking a shower in the bathroom.,-1
what would you do?,2
he lost his life in a car accident.,40
i lost my passport!,-1
do you eat rice in your country?,3
is this your house?,35
i love my city.,-1
"where are you from, karen?",2
my mother cried because of that.,-1
my roommate is very noisy.,-1
i haven't eaten lunch yet.,3
leave it there.,-1
did you really clean the garden?,-1
"whose socks are these? ""to my sister.""",-1
she is holding flowers in her hand.,27
english is easy to learn.,49
"we work in the morning, and sleep at night.",-1
i'm still alive.,-1
their noses will bleed.,-1
he left me waiting for a long time.,-1
no school in august.,19
every child has his own way of thinking.,-1
he kissed me on the forehead.,4
he wanted his wife to wake him up early.,-1
i'm looking for someone who can speak portuguese.,48
"the world began without people, and that is how it will end.",-1
many people are trying to buy a house.,35
i can't believe what he says.,-1
his wife will be here in a few minutes.,-1
i brush my teeth every morning.,-1
i will try to stop my smoking.,81
what is he hiding?,61
he can do what he wants?,-1
i talked to him.,13
what don't you have?,-1
his blood was boiling!,7
please wash the dishes.,-1
please remember to wake me up tomorrow at seven in the morning.,-1
we danced to the music.,25
tom is naked.,1
let's forget about that.,52
it took years to build that.,-1
it's like a bird if tom eats.,1
he went to paris to study art.,34
he doesn't catch a cold.,-1
the soup was very hot.,3
water splattered from the broken faucet.,-1
i thought you two were brothers.,-1
what will you have?,2
i'm in a hurry.,-1
"don't despair, all is not lost.",47
tom is very tall.,1
would you like to come here for an interview next week?,8
that's my professor.,-1
take the bone and throw it to the dog.,45
"david is sick, isn't he?",4
mary smells the flowers.,11
why do we move?,39
try not to get wet in the rain.,50
tom couldn't remember where he hid the documents.,1
i want to see you before you leave.,0
"i will pick you up at 8 to go to the ""gym"".",-1
i watched television.,72
i don't like you,-1
will you dance with me?,2
i had lunch there at eleven because i was hungry.,3
this is the first time i have waited this long.,-1
don't worry about them.,57
is milk good?,-1
ten years is a really long time.,-1
you guys are lucky.,-1
we understand the importance of education.,15
a very strong earthquake hit mexico this fall.,-1
let's do what tom says.,1
"if i were you, i would follow him until the end of the world.",-1
thunder could be heard all night long.,-1
"i can't see your garden, but i can see mine.",-1
the child eats the meat.,-1
those are not fish.,-1
emily wants to learn greek.,-1
i forgot to put a stamp before i sent the letter.,52
we did everything for the good of our children.,-1
i will do what you want.,0
i felt someone crawl behind me.,-1
"please, take a good look at my son.",68
the light is on.,-1
tom was in the bathroom when mary arrived.,11
i have to hurry to class.,15
good morning,8
i am peter.,1
and you? what is your name,2
i hate my family.,-1
the dog looks sick.,31
have you been to nara?,2
does your sister study there?,-1
i want to know where that came from.,-1
i want to stay alone.,73
i haven't slept in three days.,-1
i don't give second chances.,-1
i don't know if he knows.,9
that hit close to home.,-1
don't stone the dog.,-1
the egg is the universal symbol of life and rebirth.,-1
i have something to show you.,-1
i am also 17 years old.,28
whose money is it?,-1
this candy costs eighty cents.,-1
i think that's what happened to tom.,1
he woke me up early.,-1
i can't agree with you on this.,-1
what happens if we press that button?,-1
milk makes us strong.,-1
the world is more dangerous than i thought.,-1
count from one to one hundred.,-1
"fill it in, please.",-1
i want tom to have a copy of my novel.,6
you jump.,0
i love your oldest sister very much.,-1
i have to get up early tomorrow; can you call me at six?,26
pavel will arrive after two o'clock.,8
i know you love me,-1
i don't know what happened to you.,10
he is mirrored.,13
"where there's smoke, there's fire.",-1
here is the boy.,68
he lives in a mansion.,35
i am a careful person.,-1
can we wait a little longer?,2
young men have their own bikes these days.,40
i thought you were inside your room.,-1
"mary wants to lose some fat, but tom doesn't think she needs to.",11
don't leave without getting anything.,47
i will go home with you.,8
did dad know you broke his watch?,-1
"one day, you will see me.",0
this is the school where he teaches.,15
everyone was looking at tom.,1
i will never betray you.,-1
a man was hit right in front of my house.,-1
i was alone and didn't know what to do.,73
there are some animals that are unique to su.,29
they are not interested in other languages.,63
you have to leave right now.,-1
a baby is sleeping in the crib.,23
don't say i said that.,-1
"he tried to solve the problem, but he had no luck.",4
teaching children is not easy.,15
we gave the books to the students.,15
i haven't seen maria in four months.,-1
he learns quickly.,-1
why does everyone hate me?,39
how long,78
i don't want to bet.,58
"do you have a brother, ana?",76
"in american movies, the negro always dies first.",-1
you need to study like your sister.,-1
tom plays chess better than me.,-1
a mountain does not need green.,-1
it all started the day i was born.,-1
i think i'm going crazy.,31
does he know how you feel?,-1
where do you live now?,2
who did you call on the phone?,26
want to do that now?,2
that's cheap.,-1
i want to see what's inside.,-1
give me half a kilo of apples.,20
do you want to dance?,2
i don't know what to do from now on.,10
the old man died this morning.,-1
i came to tokyo three years ago and have been living here ever since.,14
i'm sure tom would do the same.,1
that's why i didn't come yesterday.,-1
when did you learn to drive?,5
are there people who do not know a single word of english?,63
it was the first time i sweated so much.,-1
your sign.,0
he smokes a cigarette after lunch.,81
the accident caused many deaths.,40
we seem to have escaped the danger.,0
i will help tom.,1
this cheese is made from goat's milk.,-1
he didn't even have a pencil.,-1
do you see anything?,2
i didn't know you were that kind of person.,10
is it a sin if i'm gay?,-1
"it was saturday night, yes, sunday.",8
he is drunk.,51
i can't believe that.,-1
close your eyes until i tell you to open them.,30
i thought you hated tom.,1
i do my homework after school.,15
"alright, i'll leave you alone.",-1
he looks like a musician.,25
there is no dog bigger than this.,-1
the old man is in bed.,-1
the food smells delicious.,3
i will never leave you.,-1
the refrigerator is dirty.,-1
he did nothing wrong.,-1
tom is avoiding you.,1
you admit you were wrong.,42
he woke up alone.,-1
all children understand.,-1
they helped him get to canada.,-1
my birthday is in november.,66
he will be back after lunch.,-1
will it take you long to arrive?,2
open your heart.,-1
mr. legros can read the alphabet upside down.,-1
the students laughed.,15
that's not very important.,-1
my daughter likes egg yolks.,3
the cat is not mine.,5
they have a bush full of apples.,20
he has no time to play cards.,19
they stink.,-1
there is an apple on the table.,20
he was very happy to see her.,12
"he grew up near the sea, but he never wanted to swim.",-1
water and oil cannot be mixed.,10
you need new shoes.,-1
when are you coming back to the united states?,2
i don't need money now.,-1
tom and mary are at home today.,11
i wish i had followed the doctor's advice.,54
i'm missing can you help me,-1
there is still much to do.,59
we heard our dog barking all night.,-1
"good evening, my dear friend!",-1
he is lying.,-1
how long is the flight?,-1
the men went hunting.,-1
are you two okay?,2
give me the key.,-1
"a tomato is a vegetable, not a fruit.",20
c-47 lands.,69
what are you doing at linngo?,-1
he is cruel.,4
get him out of here.,-1
we are breathing clean air.,-1
his father died.,-1
i am from kyoto.,14
i don't want to live.,-1
what do you do when you can't?,47
tom lost his wife.,1
tom said he was thirty years old.,1
don't be late to class again.,15
tell me the story.,-1
this is a picture of the ship i was on.,33
don't give up!,-1
no one can teach a person - he can only learn on his own.,9
i want to see mr. kosugi.,-1
now you are safe.,-1
tom got a cab for me.,5
i want to have breakfast with you.,3
i am writing that on behalf of our friends who lost their lives.,-1
"while you are here, you are safe.",-1
"it was dark, so i went home.",8
he is angry with his wife.,-1
what does the girl want to know?,2
what does tom want to know?,1
when was the last time you took the kids to the beach?,33
i left my watch at home.,-1
mary and jane are cousins.,11
i don't believe him anymore.,-1
you cannot accompany the patient during the operation.,54
i'm really ashamed of myself for what i did.,31
what building is that?,-1
"have you ever taken your dog to this ""beach""?",45
where did he go?,61
everyone wants a reform in the education system.,15
which bed do you want to sleep in?,23
he agreed with my idea.,13
the girl is jumping.,-1
i went to the airport to say goodbye to a friend.,-1
i read a few books to my son every night.,6
plastic chairs are cheap.,41
write the alphabet in capital letters.,32
i want to go on vacation to poland.,-1
"if you want to go, go.",-1
this is not new.,-1
those are my books.,6
"i will never agree with you, no matter how reasonable your ideas are.",-1
"call me later, okay?",26
you are wasting your time.,-1
i have never seen such a bird before.,53
what do you want to know about my work?,-1
tom only knows that he is mary's father.,11
dad went fishing.,38
i know that i know nothing.,-1
tom can't dance.,1
tom and mary became best friends.,11
"tom knew the truth, but he didn't let others know that he knew.",-1
nobody likes that.,-1
don't believe too much.,-1
i think it's about time i show you how to do that the right way.,0
i will walk,0
i'm leaving,-1
my girlfriend is chinese.,14
i left a message for you all.,-1
how did tom die?,1
i can't speak or write french.,63
i will never hurt you.,-1
what time does the train leave for boston?,18
i have been studying for two hours.,-1
they hugged.,-1
he is drunk.,51
the weather is beautiful.,22
they became lovers.,-1
his strength.,13
tom and mary will have a child.,11
"i eat anything, except onions.",3
suddenly his face turned pale.,4
do you need our help?,2
none of the cars are mine.,19
my birthday is coming up.,66
can you tell me why you like him?,65
don't be shy.,70
i woke up at five o'clock.,-1
does mr. pedro live here?,61
i don't know where to wait for him.,-1
i am swimming in the ocean.,33
the problem is that you are still young.,-1
can i sit next to you,-1
it has happened before and it may happen again.,-1
you can sit here.,-1
take only one.,-1
this room doesn't get much sunlight.,-1
the whole world knows his name.,12
i will bring home a lot of food.,3
can i use the bathroom,-1
this watch is worth a lot.,-1
you can call me any time.,26
copy tom's address for mary.,11
i am fat.,-1
"when one doesn't want to, the two won't fight.",-1
i like the color red.,-1
jody seemed to see a ghost.,-1
you are my friend,44
you don't play with those toys anymore.,-1
maybe we should give those away.,0
who found a lost dog?,45
my father takes a bath before dinner.,38
i wash my hands because they are dirty.,-1
first i want you to tell me how you got there.,-1
"tell him the truth, that's all.",-1
i have lived here for many years.,-1
"goodbye, sayoko!",-1
"as far as i know, he is not married.",9
where can i find you,-1
the french president visited okinawa.,14
i have to brush my teeth.,-1
ken needs to run fast.,-1
lots of flowers in the garden?,27
you need to practice your violin every day.,8
"when you eat too much, you will gain weight.",3
there is no smoke without fire.,-1
this bike needs repair.,40
