document,topic_id
"in case i can't make it, you go alone.",9
"it's no use giving incentives, he doesn't change.",-1
which would you choose?,-1
i will take care of him myself.,-1
the weapon is mine.,69
look what the cat brought here.,5
"tomorrow is my birthday, and i will be 17.",28
i'm not hiding anything from you.,-1
he would never visit the city again.,-1
don't underestimate us.,-1
you have to persevere until you get it.,-1
i saw it on the discovery channel.,72
what tom really wants is a new guitar.,25
next year is an election.,0
"more than 3,000 people went to the concert.",-1
my friend is seventeen years old.,28
"he promised to marry her, but they never got married.",9
the effect is easy.,0
all you have to do is press this red button.,-1
japan is in asia.,14
i will do the work tomorrow.,8
the truth is that he never went to america.,-1
mary's husband is plump.,11
i want your love.,-1
"when you eat that much, you will gain weight.",3
come on!,7
he went with her to the cinema.,12
tell me.,0
they live near the airport.,-1
that room is not that big.,-1
nothing is more important than time.,-1
his parents are with him.,43
that is unnecessary.,-1
black is mine.,0
the children ran fast.,-1
he didn't want to go to boston.,9
he is the chosen one.,-1
yes.,0
tom did not know the boy who was talking to mary.,11
he knows the city well.,-1
turn on the tv.,72
you don't look.,10
"hey, dude. how are you",2
that's for my family.,43
guess who i am,-1
i don't swim very well.,-1
what do they want?,2
his number is wrong.,26
classes are suspended due to the flood.,15
i lost my pen.,-1
i saw the game on television.,72
i was afraid of the cat.,56
don't touch my child!,80
he seems happy.,13
"he asked me: ""who came first?""",61
i sincerely gave him the little i had.,12
we went to the park to take pictures.,-1
please wait,0
i will connect you to him.,0
"on clear days, mount fuji can be seen.",-1
"we sang, danced and talked after dinner.",-1
do you think our climate has an influence on our character?,-1
what time do you watch television?,72
we asked his sister to be kind and dedicated.,-1
i went to the library to read a book.,6
are you hungry,3
it is easier to plan than to implement.,-1
we need to deposit this money in a bank.,-1
"as far as i know, he is a diligent student.",48
what time do i have to arrive?,8
i know a man who knows french.,34
"after all the work at home, he sat on the sofa to watch television.",72
those are my sister's books.,6
we rented a car for a week when we were in italy.,77
did you like the bike?,40
"when he bit me, it hurt so much that i lost consciousness.",4
"why people can be classified into those categories, meanwhile, is a mystery.",-1
progress cannot be stopped.,-1
is this french correct?,34
"must eat to live, and not live to eat.",-1
they are saving money for a house.,35
that little skirt is pink.,27
i finished cleaning my room.,-1
"maybe you're right, i hate it so much.",42
there are many parks in our city.,-1
i will not write a letter in english.,63
we need leaders.,0
he gave me some of his soup.,3
are you at home,-1
they told me,-1
many soldiers died in world war ii.,69
not everyone knows what that means.,-1
not everyone knows the meaning.,10
do you know if lucia can speak japanese?,14
"it hasn't rained yet, but it's about to.",-1
i don't like this dress. show me something else.,-1
i want you to sing to me.,0
that train arrives in chicago at 9 tonight.,18
a small car is cheaper than a big one.,5
i'm always the first to arrive.,-1
are you there,2
this day is tiring.,-1
chopin sat down in front of the piano and began to play.,25
i need to add new dictionaries to the library.,6
i admit i forgot what i wanted to ask.,52
he took the chicken.,53
there are animals here.,29
he has to come here.,-1
someone must take care of the patient.,54
"let's go to the dead. ""who died?""",64
the two buildings are adjacent.,-1
you were so careless that you left your suitcase behind.,-1
he is not running.,9
let me look into that.,-1
he just wants to fool you.,-1
i won't let him fool me.,-1
i walked up to the door.,30
you are a bad person.,42
can i sit next to you,-1
"if he comes, tell him to come to my living room.",-1
how many times a week do they collect garbage in this city?,-1
three workers in the truck were killed in an accident.,40
you don't have to stay.,57
the person i was waiting for did not show up.,-1
he will go to sleep.,23
the key is on the writer's desk.,32
the cloud is shaped like a bear.,-1
you have to please your parents.,43
i will remember you forever.,-1
you do not have permission to enter this room.,-1
i saw it with my own two eyes.,79
"it's a beautiful sunset, isn't it?",22
he did it slowly.,-1
i would like to go to the united states.,-1
have you ever heard someone speak esperanto?,-1
"while some people want to have new shoes, others want to... just have feet.",-1
there will be a snow storm.,46
children make sand castles on the beach.,33
the floor is wet with water.,-1
i can sing well.,0
no one is better than him.,-1
i need a driver to take me home.,8
tom doesn't like cheese.,1
"before you leave the house, please turn off the lights in the kitchen and living room.",-1
i thought you wouldn't come.,10
his name is tom.,1
are you new here?,2
"all men are mortal, all greeks are men, therefore, all greeks are mortal.",64
my older sister swims very fast.,-1
bring it for your mother.,21
the school was reduced to ashes.,-1
only the dead saw the end of the war.,-1
does one of those rooms have a clock?,-1
we won the game.,0
the car broke down.,5
think it's a good idea to feed the dog leftovers?,3
one of my friends lives abroad.,48
we'll be there in an hour.,8
why don't you check out these data?,-1
i should accompany you.,0
this is the first time i will open this door.,-1
i pressed the red button but nothing happened.,19
i saw you talking to tom.,1
you need to do things that will help your children have a good life.,43
he came late.,-1
he didn't go to school because he was sick.,4
"if you are happy, i am happy.",-1
can you give me a clean knife?,-1
that's not what gentlemen think!,-1
"if i were rich, i would buy it.",-1
you don't have to dance unless you want to.,47
sand got into my eyes.,79
walk slowly.,0
"maybe, andy practiced a lot.",12
i can't remember his name at this hour.,-1
wash your face and hands.,-1
she is young and charming.,12
i'm sure you'll be good at it.,0
there was a slender puppy on the table.,41
welcome home,8
who is this old woman?,21
i have a lot of unnecessary things.,10
i'm older than your brother.,76
as far as i know this is the best.,0
my dream is now a star without brightness.,-1
the forest is full of trees.,29
whose drawing do you like?,2
he is not here now. why are you looking for him?,65
i didn't want this to happen.,10
i am as old as him.,-1
can i use your dictionary,-1
please open your eyes.,30
do find me a good book in the library.,6
i have to think.,-1
we didn't go through with the picnic plan.,-1
my appetite is small.,3
he is my neighbor.,-1
i want to lose weight.,-1
"i will start,",0
i will make you happy.,-1
i don't want to sleep!,23
it's time to sleep.,23
"according to the radio, it will rain tomorrow.",18
he is twelve years old.,-1
he is tall for his age.,28
where is father juan?,38
there is no bathroom here. pee behind that very tree.,-1
incorrectly copying a classmate's lesson.,15
can you tell me how to get to the station?,18
"we go to school every day, except during the week.",8
he stopped near tom's chair.,1
they stayed together for another day.,-1
thank you for congratulating me.,67
he wants a divorce.,-1
we see thousands of stars in the sky.,22
there is not a single star in the sky.,22
he is fed up with his job.,-1
the weather was rough for a whole week.,-1
"even if the husband is more strict, that is better than being alone.",-1
her outfit drew the attention of everyone present on the occasion.,-1
the public applauded the actress.,-1
"after breakfast, we went for a walk.",-1
do not make noise on this occasion.,-1
"if possible, i would like to see you.",-1
i ask you to put it back in its place.,-1
there is a lot of furniture in this room.,-1
she gave birth to twins.,-1
i have been looking for a job for a long time.,-1
"no matter what he eats, he doesn't gain weight.",-1
i made a big mistake.,-1
the gentleman can sit here.,-1
tom takes a bath before breakfast every day.,1
only those with ids will be allowed to enter.,-1
show your id before i let you in.,-1
"you left your id at home, so you can't enter.",-1
don't forget your id so you can enter the concert tomorrow.,-1
we don't have that in europe.,71
i'm really happy for you.,0
why is life full of pain?,-1
you are so beautiful when you are angry.,-1
what are they building in this place?,-1
the car is old but nice.,5
don't talk to me!,80
he did not catch the train at eight o'clock sharp.,18
do you want to go to the concert with me?,-1
he apologized for not showing up.,9
he lost his sight in the accident.,40
"regarding the operation, it can be painful.",31
i want to buy another one.,-1
"because i didn't know what to do, i didn't do anything.",-1
"have the children arrived? ""not yet, not one.""",-1
mary is happy.,11
what you say has no effect on me.,-1
how beautiful you are!,-1
tom asked mary where john lived.,11
don't stop him.,58
scientists are thinking of new ways to increase the world's food supply.,3
he seems to be doing as much as tom.,1
the city is small.,0
a truck ran over our dog.,5
don't open the door.,-1
ask him how much soup he wants.,3
"for example, it is seven o'clock in london today.",8
do you believe in a god?,2
you are not afraid of anything.,70
the next train has much less people than this one.,18
say goodbye to your friends.,-1
you might be late for school.,-1
he is weak in chemistry.,4
the apple tree has little fruit this year.,20
his father wanted him to be a pianist.,25
how much should i pay?,-1
i hope you fall into a trap.,-1
where did you learn english,49
the hat is too small for me.,-1
i want to know you better.,0
you are the only person i know who is my age.,-1
i confessed that i stole the money.,-1
he doesn't remember anything.,-1
you will die!,-1
my family wakes up early.,-1
do you all speak french?,34
he poured the milk into a bowl.,24
my feet are very cold.,46
the radio is broken.,18
betty killed her own mother.,-1
i did that only for your own good.,-1
my car collided with a motorcycle.,40
at your request.,0
why are you so mad at me?,39
our time is short.,-1
is there a bank near here?,2
mike has a friend who lives in chicago.,-1
they believed that chance would be different; that their voices are the difference.,-1
he is not hungry.,-1
why is he so famous?,-1
it's not important anymore.,-1
i would love that game.,-1
my debt is huge.,17
soldiers have weapons.,69
i would have bought it if it wasn't so expensive.,17
must follow the rules.,0
tom bought two copies of that book.,6
he is not happy with all his success.,4
he lives in new york.,-1
i have to feed my cat.,5
in the kitchen.,-1
he can't buy a car.,9
can he do that?,-1
i did all the work.,59
i did not answer either of those two letters.,-1
i'm doing something now.,0
tom is always tired after work.,1
he has a pianist daughter.,25
really cheap.,-1
she is happy with the new clothes.,-1
everyone knows that two more than two is four.,-1
tom doesn't know if maria will come with him tomorrow or not.,11
they are here.,0
he is here to learn.,-1
i wonder why for some people black cats bring bad luck.,5
tom teaches french in boston.,1
that's my dad's.,38
he finally did.,13
are you interested in flowers?,27
i don't understand this word. do you have a dictionary,-1
"without air and water, nothing could survive.",47
egg yolk is one of the main sources of vitamin a.,3
why are you hurting me so much?,39
what is that in your hand?,-1
you have to get back before dark.,-1
jim wrote to me last week and he said he's been back for two months.,-1
we went back to my house for dinner.,-1
i want to play tennis with you one day.,75
you have a great idea.,82
"i have two sons, one in tokyo and one in nagoya.",14
they took my blood at the hospital.,-1
where is the museum?,-1
it's not possible here. the sun is very hot.,22
what a big dog!,7
he saved me.,13
he writes to his parents once a month.,55
turn off the light.,-1
"and you, who are you?",2
i am paulo.,-1
what should i do?,2
are those girls in white skirts?,21
the vacation is over.,0
do you know how our life would be without electricity?,-1
dad has stopped smoking.,38
roger works from morning to night.,-1
i feel like sneezing...give me a tissue.,-1
he wanted to see her again.,12
i am closing my shop.,-1
he wants to eat this fruit.,20
termites eat wood.,-1
do you understand everything he says?,-1
john was the taller of the two boys.,-1
did they say how?,9
i'm nervous.,56
i'll call you when i get to the station.,18
we will never agree.,-1
do you know whose car that is?,5
i want to be with you.,0
i love my husband.,-1
which school are you going to?,2
his profession is teaching english.,49
oh! my computer is broken!,36
the professor showed us how to use the computer.,36
do you remember when you first ate at this restaurant?,-1
go up to the roof.,0
i want to go to the united states one day.,48
this bus will take you to the station.,18
the rain just stopped.,50
we can now begin.,0
this ruler can be read using two different methods.,-1
he is stubborn.,4
what do you want to do tomorrow?,8
he didn't want to accept the biscuit i offered.,3
we found out that he had an accident.,4
i had nothing to do with that incident.,-1
"he was born french, but is now a citizen of the united states.",48
taste it.,-1
he now knows what i mean.,12
you found a nice guy.,-1
our ship suffered no damage in the battle.,70
tom has a black cat.,1
students don't raise their hands much.,15
when did you come home?,-1
i thought i knew everything.,0
i really like the sound of his name.,13
i wonder why he did that.,12
i don't have enough money now.,17
i'm afraid to leave.,56
the prisoners were released by the governor.,-1
i can't climb this mountain.,10
he was on the phone.,26
do you have anything to do on friday afternoon?,8
"even if you are rich, i doubt you will be happy.",-1
jim has a white hat on his head.,-1
i don't know how to say thank you.,-1
you don't have to do that right now.,-1
take care! the car is here.,5
i have peace at home.,8
tom keeps all the letters that his mother sent him.,-1
he is so tall!,7
it's morning. children eat breakfast.,3
i am a cook.,-1
i want a server.,-1
tom feeds his dog twice a day.,1
he asked me for permission to use the phone.,26
have you called him yet?,26
there is a hotel here.,-1
"do you want to be a millionaire? ""who doesn't want?""",2
he can speak five languages.,-1
his ambition drives him to work hard.,12
he's here!,7
this is the first time i have invited mary.,11
"at that time, my house was still under construction.",35
"despite his young age, he did a good job.",-1
why do you clean the house every week?,8
does anyone disagree with the new plan?,-1
i would like to take this opportunity to thank everyone who has given their cooperation.,67
what nonsense!,7
put the gun down.,-1
you can't always get what you want.,-1
"yes, i like that.",0
the store was closed when i went.,-1
one thing you need to know about me is that i hate working out.,-1
he tells her that he will follow her wherever she goes.,-1
i looked for you.,-1
he was born in africa.,-1
tom is a famous painter.,1
what did they hit you with?,-1
must wash hands before eating.,-1
this table is dirty.,41
why don't we move to that table?,57
that's the building where my dad works.,38
i will never fool you!,-1
i hope you didn't tell him anything about the plan.,-1
you're not mexican?,-1
"yes, but i now live in argentina.",0
that's not right; apologize to him.,9
the woman is fat.,21
they will answer.,0
very quiet.,7
our time is running out.,-1
tom bought a used truck.,5
tom was imprisoned by them.,1
he made her do that.,12
all we want to do is eat.,3
i would love to see your stamp collection.,-1
divide that cake between the three of you.,74
i just want to see what happens.,-1
take care tom.,1
"even though i was tired, i continued to work.",59
i was confused by the expression on his face.,4
i promise you i will never do that again.,-1
i understand why.,39
i have so many questions.,0
are you fooling me,2
i will work all day tomorrow.,8
"because i couldn't pay the rent, i asked him for help.",9
what did you eat,3
i will sell my house.,-1
this rose is beautiful.,27
there was an earthquake yesterday.,-1
there was an earthquake yesterday.,-1
the two girls laughed.,-1
take that.,0
he never traveled by train.,-1
did you find that on the internet?,36
mary is respected by everyone.,11
i always tickle my youngest brother's feet.,-1
he was deeply saddened by the news.,4
victory is ours.,0
it was raining when i was walking yesterday.,50
i want to live in italy.,77
i am in the library.,6
what a mess!,7
i slapped him.,4
tom told me he didn't recognize mary the last time they met.,11
i was playing when i felt the earthquake.,-1
his wound bled.,4
"whenever he sings, all the birds seem to accompany him.",-1
it's very dark out there.,-1
a lot of rotten apples in the bush.,20
we start in half an hour!,-1
do you understand him?,39
"oh, it's cold today.",46
"take good care of him, he will get well soon.",-1
can you tell the difference between a japanese and a chinese?,14
"even though i've been sick for a month, i'm doing everything to get better.",-1
i counted to 200.,28
"you came to school yesterday, didn't you?",-1
he is your friend.,44
my husband will kill me.,-1
today is very hot.,22
tell us more.,0
the printer doesn't seem to connect to my computer.,36
what is more important?,-1
our cow does not give milk.,-1
this is what i need.,0
tom didn't know mary very well.,11
i'm not in the meeting.,-1
i have bad news for you.,42
they didn't know what to do with him.,9
i have no patience.,-1
he licked his lips.,4
they defended their country.,-1
i jumped out of bed.,-1
don't worry.,-1
i heard you also collect stamps.,-1
we are not the only ones who believe he is the culprit.,-1
do you know how to make plaskards?,-1
tom wants evidence.,1
i have a pen.,32
kick him!,7
you don't have a single piece of evidence.,-1
health is more important than wealth.,-1
"i would like to go, but i don't have a car.",19
there is more to do.,-1
but why would you hide your love from him?,-1
the man is dying.,-1
the pacific ocean is vast.,33
your hair is very long.,21
i worked all day yesterday.,8
you better leave tom alone.,1
i need you here.,0
don't punish him.,-1
he is not guilty.,-1
my youngest brother is still sleeping.,23
we are learning french.,34
his house is near the river.,35
you are progressing.,-1
my big toe started bleeding.,-1
tom filled the box with food.,1
the postman hasn't been here yet.,-1
he cut his hair.,-1
can you email that?,-1
have you finished reading the newspaper?,-1
i'm not sure when he'll be back.,9
i can't find my pocket.,17
he weighs seventy kilograms.,-1
why is tom doing that?,1
sorry we can't help you.,10
betty killed everyone.,-1
hopefully scientists will find a solution to aids soon.,-1
come in here.,0
we were not at home yesterday.,19
he wants to see you dead.,-1
he was blinded.,4
he was laughed at by the other boys.,-1
i was born in osaka.,-1
which snake is the fastest in the world?,-1
i didn't notice him.,-1
you don't have to go to school today.,-1
the police did not find any evidence of anyone.,9
a river divides the city.,-1
"yes, bob helped me.",0
"you don't have any plants or animals, do you?",-1
you wear expensive earrings.,-1
"sorry, don't shout!",80
my mother is a good cook.,-1
are you still married?,2
things that happened are in the past.,-1
his brother has disappeared from the city.,-1
"next year, my birthday will be on a sunday.",66
tom likes reggae.,25
that is in god's hands.,-1
"yes, come here exactly at 3 o'clock.",-1
mount fuji is about four times higher than mount rokko.,-1
did you know that julia lived in moscow for 10 years?,21
that's why he speaks russian very well.,-1
"antoine lavoisier died in paris, france.",34
what is the reason?,39
the cause of his toothache was that he ate too many sweets.,4
are you spanish,2
"no, but i know how to kill.",-1
"you don't care, do you?",-1
"he likes to gossip, so he has many enemies.",4
i fell asleep before dad came home.,-1
i cooked eggplant and eggs for breakfast.,3
eggplant is delicious if you eat it with vinegar.,3
is there a white eggplant?,3
they say that eggplant has a lot of nicotine.,81
"he doesn't eat it, does he?",-1
tell me what you find out.,65
i am a muslim.,60
the dog chases the cat and the mouse is chased by the cat.,5
i received his call yesterday.,26
the structure could not withstand the earthquake.,-1
there is no stopping if women talk.,-1
it doesn't look like an artist painted it.,-1
you don't know what it's like to lose a family in a war.,9
i suspect he is involved in terrorism.,-1
this hotel belongs to my husband's brother.,-1
this hotel belongs to my brother-in-law.,-1
i can't start the car.,5
that's because his father worked there.,38
your brother won't buy that.,-1
he moved like a gay man.,4
all the rebels are dead.,-1
he is the son of my uncle and aunt.,55
he is my cousin.,76
"i love how the french write the word ""ladybug"" in their language.",-1
i'm lazy to work.,59
it is dangerous to enter the enemy's camp.,69
no mangoes are blue.,-1
don't leave me alone!,80
my room is number 5.,-1
you have to be obedient to your parents.,43
the thief confessed to the theft.,-1
she avoids talking about her husband's death.,47
i don't like sad shows.,-1
the floor of that hut was made of bamboo.,-1
the only carrot in the kitchen became the nose of the snowman we made.,46
she attracts hairy men.,21
the young thief was never seen again by the police.,62
"for him, floods cause less fear than earthquakes.",47
i want to read that book when you finish reading it.,6
did you go to cairo or to alexandria?,-1
you must be sad because one of your friends died.,-1
i didn't know that the fruit was wormed before i peeled it.,20
"even though this fruit has no wound, it smells very bad.",20
there are restaurants right inside the airport.,-1
they said he was sick.,4
the sea is very green.,33
i believe in friendship.,44
he holds a ladle in his left hand.,-1
he has four cell phones.,26
you write and the children write; you all sit and write.,55
the bus has many things that can burn.,18
i found a piece of paper in the room.,32
we no longer need to evacuate because the flood has receded.,47
it will be difficult to convince the owner to sell the house.,35
i'm sure tom will get over it.,1
there is not even a guard at the entrance of this restaurant.,-1
the mouse ran under the bed.,-1
the world is shaped like a ring.,-1
how do i get to su from here?,-1
tomas is to blame for all of this.,1
the noise of cars here to us.,5
the voices of the people inside the office were weak.,-1
the amazon is a river.,-1
he always comes early.,-1
squid ink is edible while pen ink is not.,32
wait until i come back.,-1
don't move that spoon and glass.,-1
he hid his ugly face.,4
tom has an ugly face.,1
"when you want to cry, cry.",31
do you want to leave it at that?,-1
avocado is a fruit.,20
i will make coffee.,24
"would you like to leave a message? ""no, thank you.""",-1
my godfather gave me that red dress.,-1
the child defecated while in the classroom.,15
your shit stinks.,-1
your child peed in the diaper.,68
this book is very important to students of science.,15
i don't know if there is pandesal in other countries too.,-1
it's good to eat pandesal with coffee.,24
many pandesals are now no longer salty.,-1
contribute to tatoeba.,-1
tell the truth.,-1
he may not be happy.,4
blood dripped from his wound.,4
mental health is more important than physical health.,-1
my sister doesn't like to cook.,-1
i haven't kissed her yet.,-1
he can do nothing but accept.,-1
he is blind in one eye.,79
firefighters helped him.,-1
he no longer buttered the surface of the burnt bread.,3
"help me, please?",2
do you have a needle and thread?,2
this sentence is correct.,0
it's a wonder he's not here.,9
he always comes at this time.,-1
"you should apologize to him, and now.",-1
where did you feed them?,-1
i'd rather go out than stay in.,-1
"tom ate some of the ham, and then hid the rest in the refrigerator.",1
we stood up together.,-1
i had to give tom a little help.,1
take it easy. i can't hear you.,10
isn't that black?,-1
can i turn on the light,-1
"come on, let's swim.",0
i'm so tired of living.,-1
neither of us answered.,-1
why don't you understand?,-1
we want to learn some spanish songs.,-1
he has no children.,19
he breathed deeply.,4
you are afraid,56
you are afraid.,56
you are afraid of me.,56
kings have long arms.,-1
do you think it's impossible to finish work before five o'clock?,-1
do not repeat that word inside the house of god.,-1
tom didn't have to paint the fence.,1
they removed it a week after he painted it.,-1
how many of your students are here?,15
they have two daughters.,-1
we have to defend our country no matter what we spend.,-1
"when my parents find out you're here, they might do something unpleasant.",-1
i have been a teacher for fifteen years.,28
who is marco?,2
he is my brother.,76
i think your work is okay.,0
he always listens to the news on the radio.,18
i know what you're thinking of doing.,0
that chapel was built by the spaniards centuries ago.,-1
am i wrong?,2
the food is cold.,3
it is the tallest tower in japan.,14
he spun around when he heard his voice.,-1
can you lend me a stapler?,-1
"we waited for a long time, but he did not appear.",-1
"at that age, you should know better.",28
he played tennis all day.,75
"me too, i want that dress.",-1
he looked at her in the mirror.,-1
tom challenges mary to a game of chess.,11
"this time, you cannot escape the punishment.",10
he is a very diligent student.,15
"he who wakes up early, gets rich easily.",-1
